{
  "$schema": "https://json-schema.org/draft/2020-12/schema",
  "title": "SweetUI item",
  "type": "object",
  "required": [
    "schemaVersion",
    "version",
    "name",
    "kind",
    "description",
    "files",
    "registryDependencies",
    "packageDependencies",
    "platforms",
    "tags",
    "accessibility"
  ],
  "allOf": [
    {
      "if": { "required": ["kind"], "properties": { "kind": { "const": "recipe" } } },
      "then": {
        "required": ["docs"],
        "properties": { "files": { "maxItems": 0 } }
      },
      "else": {
        "required": ["preview"],
        "properties": { "files": { "minItems": 1 } }
      }
    }
  ],
  "properties": {
    "$schema": { "type": "string" },
    "schemaVersion": { "const": 1 },
    "version": { "type": "string", "pattern": "^[0-9]+\\.[0-9]+\\.[0-9]+$" },
    "name": { "type": "string", "pattern": "^[a-z0-9]+(?:-[a-z0-9]+)*$" },
    "kind": { "enum": ["component", "block", "flow", "recipe"] },
    "description": { "type": "string", "minLength": 1 },
    "usage": { "type": "string", "minLength": 1 },
    "docs": { "type": "string", "minLength": 1 },
    "files": {
      "type": "array",
      "items": {
        "type": "object",
        "required": ["source", "target"],
        "properties": {
          "source": { "type": "string" },
          "target": { "type": "string" }
        },
        "additionalProperties": false
      }
    },
    "registryDependencies": {
      "type": "array",
      "items": { "type": "string" },
      "uniqueItems": true
    },
    "packageDependencies": {
      "type": "array",
      "items": {
        "type": "object",
        "required": ["package", "product", "requirement"],
        "properties": {
          "package": { "type": "string" },
          "product": { "type": "string" },
          "requirement": { "type": "string" },
          "sourceURL": { "type": "string" },
          "swiftPM": {
            "type": "object",
            "required": ["kind", "minimumVersion"],
            "properties": {
              "kind": { "enum": ["upToNextMinor", "upToNextMajor", "exactVersion", "range"] },
              "minimumVersion": { "type": "string", "pattern": "^[0-9]+\\.[0-9]+\\.[0-9]+$" },
              "maximumVersionExclusive": { "type": "string", "pattern": "^[0-9]+\\.[0-9]+\\.[0-9]+$" }
            },
            "additionalProperties": false
          }
        },
        "additionalProperties": false
      }
    },
    "platforms": {
      "type": "array",
      "minItems": 1,
      "items": {
        "type": "object",
        "required": ["name", "minimumVersion"],
        "properties": {
          "name": { "enum": ["iOS"] },
          "minimumVersion": { "type": "string" }
        },
        "additionalProperties": false
      }
    },
    "tags": { "type": "array", "items": { "type": "string" }, "uniqueItems": true },
    "aliases": { "type": "array", "items": { "type": "string" }, "uniqueItems": true },
    "accessibility": { "type": "array", "items": { "type": "string" } },
    "preview": {
      "type": "object",
      "required": [],
      "properties": {
        "source": { "type": "string" },
        "name": { "type": "string" },
        "screenshots": {
          "type": "array",
          "items": { "type": "string" },
          "uniqueItems": true
        }
      },
      "additionalProperties": false
    }
  },
  "additionalProperties": false
}
