{
  "$schema": "../schema.json",
  "schemaVersion": 1,
  "version": "0.2.1",
  "name": "card",
  "kind": "component",
  "description": "Styles GroupBox: bordered surface, adaptive label, content spacing.",
  "usage": "GroupBox {\n    Text(\"Manage billing and renewal details from your account settings.\")\n} label: {\n    Label(\"Subscription\", systemImage: \"creditcard.fill\")\n}\n.groupBoxStyle(.registryCard)",
  "files": [
    {
      "source": "sources/components/RegistryCardStyle.swift",
      "target": "RegistryCardStyle.swift"
    }
  ],
  "registryDependencies": [],
  "packageDependencies": [
    {
      "package": "SweetUI",
      "product": "SweetUIFoundations",
      "requirement": "0.x",
      "sourceURL": "https://github.com/mangobyte-dev/sweetui.git",
      "swiftPM": {
        "kind": "upToNextMinor",
        "minimumVersion": "0.5.0"
      }
    }
  ],
  "platforms": [
    {
      "name": "iOS",
      "minimumVersion": "26.0"
    }
  ],
  "tags": [
    "card",
    "group-box",
    "surface",
    "container",
    "style"
  ],
  "aliases": [
    "group-box",
    "surface",
    "panel",
    "product-card"
  ],
  "accessibility": [
    "Preserves reading order (label, content).",
    "System styles; grows Dynamic Type.",
    "Leading alignment follows layout direction.",
    "No interaction/selection added."
  ],
  "preview": {
    "source": "sources/components/RegistryCardStyle.swift",
    "name": "Card",
    "screenshots": [
      "docs/images/items/card-light.png",
      "docs/images/items/card-dark.png"
    ]
  }
}
