{
  "$schema": "../schema.json",
  "schemaVersion": 1,
  "version": "0.2.1",
  "name": "select",
  "kind": "component",
  "description": "Adds chrome to menu-style Picker.",
  "usage": "@State private var currency = \"KWD\"\n\nPicker(\"Currency\", selection: $currency) {\n    Text(\"Kuwaiti dinar\").tag(\"KWD\")\n    Text(\"US dollar\").tag(\"USD\")\n}\n.registrySelect()",
  "files": [
    {
      "source": "sources/components/RegistrySelectModifier.swift",
      "target": "RegistrySelectModifier.swift"
    }
  ],
  "registryDependencies": [],
  "packageDependencies": [
    {
      "package": "SweetUI",
      "product": "SweetUIFoundations",
      "requirement": "0.x",
      "sourceURL": "https://github.com/mangobyte-dev/sweetui.git",
      "swiftPM": {
        "kind": "upToNextMinor",
        "minimumVersion": "0.5.0"
      }
    }
  ],
  "platforms": [
    {
      "name": "iOS",
      "minimumVersion": "26.0"
    }
  ],
  "tags": [
    "select",
    "picker",
    "menu",
    "form",
    "modifier"
  ],
  "aliases": [
    "picker",
    "dropdown"
  ],
  "accessibility": [
    "Menu, selection, dismissal, labels caller-owned.",
    "44pt height, visible disabled.",
    "Dynamic Type, layout direction."
  ],
  "preview": {
    "source": "sources/components/RegistrySelectModifier.swift",
    "name": "Select",
    "screenshots": [
      "docs/images/items/select-light.png",
      "docs/images/items/select-dark.png"
    ]
  }
}
