{
  "$schema": "../schema.json",
  "schemaVersion": 1,
  "version": "0.3.1",
  "name": "preview-02",
  "kind": "block",
  "description": "Theme wall: 35 cards, registry + native; adaptive grid, compact one-column.",
  "usage": "PreviewWall02()",
  "files": [
    {
      "source": "sources/blocks/Preview02/PreviewWall02.swift",
      "target": "Preview02/PreviewWall02.swift"
    },
    {
      "source": "sources/blocks/Preview02/AccountAccess.swift",
      "target": "Preview02/AccountAccess.swift"
    },
    {
      "source": "sources/blocks/Preview02/AlbumCard.swift",
      "target": "Preview02/AlbumCard.swift"
    },
    {
      "source": "sources/blocks/Preview02/CardOverview.swift",
      "target": "Preview02/CardOverview.swift"
    },
    {
      "source": "sources/blocks/Preview02/CatalogToolbar.swift",
      "target": "Preview02/CatalogToolbar.swift"
    },
    {
      "source": "sources/blocks/Preview02/ClaimableBalance.swift",
      "target": "Preview02/ClaimableBalance.swift"
    },
    {
      "source": "sources/blocks/Preview02/ContributionHistory.swift",
      "target": "Preview02/ContributionHistory.swift"
    },
    {
      "source": "sources/blocks/Preview02/CoverArt.swift",
      "target": "Preview02/CoverArt.swift"
    },
    {
      "source": "sources/blocks/Preview02/DividendIncome.swift",
      "target": "Preview02/DividendIncome.swift"
    },
    {
      "source": "sources/blocks/Preview02/EmptyConnectBank.swift",
      "target": "Preview02/EmptyConnectBank.swift"
    },
    {
      "source": "sources/blocks/Preview02/EmptyDistributeTrack.swift",
      "target": "Preview02/EmptyDistributeTrack.swift"
    },
    {
      "source": "sources/blocks/Preview02/EmptyExploreCatalog.swift",
      "target": "Preview02/EmptyExploreCatalog.swift"
    },
    {
      "source": "sources/blocks/Preview02/Faq.swift",
      "target": "Preview02/Faq.swift"
    },
    {
      "source": "sources/blocks/Preview02/FrontDoor.swift",
      "target": "Preview02/FrontDoor.swift"
    },
    {
      "source": "sources/blocks/Preview02/IndexInvesting.swift",
      "target": "Preview02/IndexInvesting.swift"
    },
    {
      "source": "sources/blocks/Preview02/KitchenIsland.swift",
      "target": "Preview02/KitchenIsland.swift"
    },
    {
      "source": "sources/blocks/Preview02/LoadingCard.swift",
      "target": "Preview02/LoadingCard.swift"
    },
    {
      "source": "sources/blocks/Preview02/NewMilestone.swift",
      "target": "Preview02/NewMilestone.swift"
    },
    {
      "source": "sources/blocks/Preview02/NotificationSettings.swift",
      "target": "Preview02/NotificationSettings.swift"
    },
    {
      "source": "sources/blocks/Preview02/Payments.swift",
      "target": "Preview02/Payments.swift"
    },
    {
      "source": "sources/blocks/Preview02/PayoutThreshold.swift",
      "target": "Preview02/PayoutThreshold.swift"
    },
    {
      "source": "sources/blocks/Preview02/PowerUsage.swift",
      "target": "Preview02/PowerUsage.swift"
    },
    {
      "source": "sources/blocks/Preview02/Preferences.swift",
      "target": "Preview02/Preferences.swift"
    },
    {
      "source": "sources/blocks/Preview02/QrConnect.swift",
      "target": "Preview02/QrConnect.swift"
    },
    {
      "source": "sources/blocks/Preview02/ReceivingMethod.swift",
      "target": "Preview02/ReceivingMethod.swift"
    },
    {
      "source": "sources/blocks/Preview02/RecentTransactions.swift",
      "target": "Preview02/RecentTransactions.swift"
    },
    {
      "source": "sources/blocks/Preview02/ReleaseCatalog.swift",
      "target": "Preview02/ReleaseCatalog.swift"
    },
    {
      "source": "sources/blocks/Preview02/RollerShades.swift",
      "target": "Preview02/RollerShades.swift"
    },
    {
      "source": "sources/blocks/Preview02/SavingsProgress.swift",
      "target": "Preview02/SavingsProgress.swift"
    },
    {
      "source": "sources/blocks/Preview02/SavingsTargets.swift",
      "target": "Preview02/SavingsTargets.swift"
    },
    {
      "source": "sources/blocks/Preview02/SidebarNav.swift",
      "target": "Preview02/SidebarNav.swift"
    },
    {
      "source": "sources/blocks/Preview02/SocialLinks.swift",
      "target": "Preview02/SocialLinks.swift"
    },
    {
      "source": "sources/blocks/Preview02/StockPerformance.swift",
      "target": "Preview02/StockPerformance.swift"
    },
    {
      "source": "sources/blocks/Preview02/SyncingState.swift",
      "target": "Preview02/SyncingState.swift"
    },
    {
      "source": "sources/blocks/Preview02/TransferFunds.swift",
      "target": "Preview02/TransferFunds.swift"
    },
    {
      "source": "sources/blocks/Preview02/UpcomingPayments.swift",
      "target": "Preview02/UpcomingPayments.swift"
    }
  ],
  "registryDependencies": [
    "card",
    "field",
    "input",
    "button",
    "item",
    "badge",
    "separator",
    "chart",
    "input-group",
    "toggle-group",
    "empty",
    "accordion",
    "skeleton",
    "checkbox",
    "breadcrumb",
    "select",
    "textarea",
    "progress",
    "table",
    "combobox",
    "spinner"
  ],
  "packageDependencies": [
    {
      "package": "SweetUI",
      "product": "SweetUIFoundations",
      "requirement": "0.x",
      "sourceURL": "https://github.com/mangobyte-dev/sweetui.git",
      "swiftPM": {
        "kind": "upToNextMinor",
        "minimumVersion": "0.5.0"
      }
    }
  ],
  "platforms": [
    {
      "name": "iOS",
      "minimumVersion": "26.0"
    }
  ],
  "tags": [
    "preview",
    "theme",
    "showcase",
    "cards",
    "create",
    "shadcn",
    "dashboard"
  ],
  "aliases": [
    "theme-preview",
    "create",
    "wall",
    "gallery"
  ],
  "accessibility": [
    "35 cards, one wall; regular: adaptive grid; compact: plain-non-lazy-VStack, all off-screen too (capture-route audit).",
    "Every control: accessibility-label; SF-Symbol hidden; no unlabeled control (buttons, images, switches, fields, sliders, menus, pickers).",
    "Table, sidebar, combobox, charts, date picker: native selection, scrolling, semantics; spoken labels, not glyphs.",
    "Cards: native GroupBox + controls, card-surface; respects Dynamic Type, color-scheme, direction, no-per-card-handling."
  ],
  "preview": {
    "source": "sources/blocks/Preview02/PreviewWall02.swift",
    "name": "Preview Wall 02",
    "screenshots": [
      "docs/images/items/preview-02-light.png",
      "docs/images/items/preview-02-dark.png"
    ]
  }
}
