{
  "$schema": "../schema.json",
  "schemaVersion": 1,
  "version": "0.2.1",
  "name": "scroll-area",
  "kind": "recipe",
  "description": "Scrollable content: margins, indicators, clipping.",
  "usage": "ScrollView {\n    FinanceOverview(\n        \"Overview\",\n        balanceTitle: \"Available balance\",\n        balance: Text(12_480.32, format: .currency(code: \"USD\")),\n        changeTitle: \"Monthly change\",\n        change: Text(0.082, format: .percent),\n        sectionTitle: \"Recent activity\",\n        transactions: rows,\n        onSelect: { id in }\n    )\n}\n.contentMargins(.horizontal, 16, for: .scrollContent)\n.scrollIndicators(.hidden)\n.scrollClipDisabled()\n.scrollEdgeEffectStyle(.soft, for: .top)\n.registryItem(\"scroll-area\")",
  "docs": "`ScrollView` + `.contentMargins`, `.scrollIndicators`, `.scrollClipDisabled`; scrolling/bounce/keyboard system-owned, not blocks. `.scrollEdgeEffectStyle`: content-to-glass transition, replaces background (HIG Layout).",
  "files": [],
  "registryDependencies": [
    "finance-overview"
  ],
  "packageDependencies": [
    {
      "package": "SweetUI",
      "product": "SweetUIFoundations",
      "requirement": "0.x",
      "sourceURL": "https://github.com/mangobyte-dev/sweetui.git",
      "swiftPM": {
        "kind": "upToNextMinor",
        "minimumVersion": "0.5.0"
      }
    }
  ],
  "platforms": [
    {
      "name": "iOS",
      "minimumVersion": "26.0"
    }
  ],
  "tags": [
    "scroll",
    "scroll-view",
    "margins",
    "indicators",
    "guidance"
  ],
  "aliases": [
    "scroll-view",
    "scrollview"
  ],
  "accessibility": [
    "Native scroll: VoiceOver page-scroll, three-finger gesture.",
    "Hidden indicators remove sighted affordance; prefer .automatic for long content."
  ],
  "preview": {
    "screenshots": [
      "docs/images/items/scroll-area-light.png",
      "docs/images/items/scroll-area-dark.png"
    ]
  }
}
