{
  "$schema": "../schema.json",
  "schemaVersion": 1,
  "version": "0.3.1",
  "name": "direction",
  "kind": "recipe",
  "description": "layoutDirection guidance.",
  "usage": "@Environment(\\.layoutDirection) private var layoutDirection\n\nHStack {\n    Image(systemName: \"person.crop.circle\")\n        .accessibilityHidden(true)\n    Text(\"Account\")\n    Spacer()\n    Image(systemName: \"chevron.forward\")\n        .accessibilityHidden(true)\n}\n.registryItem(\"direction\")",
  "docs": "`layoutDirection`: leading/trailing, not left/right; no replacement. `chevron.forward` mirrors; preview via `.environment`, `.rightToLeft`.",
  "files": [],
  "registryDependencies": [],
  "packageDependencies": [
    {
      "package": "SweetUI",
      "product": "SweetUIFoundations",
      "requirement": "0.x",
      "sourceURL": "https://github.com/mangobyte-dev/sweetui.git",
      "swiftPM": {
        "kind": "upToNextMinor",
        "minimumVersion": "0.5.0"
      }
    }
  ],
  "platforms": [
    {
      "name": "iOS",
      "minimumVersion": "26.0"
    }
  ],
  "tags": [
    "direction",
    "layout-direction",
    "rtl",
    "localization",
    "guidance"
  ],
  "accessibility": [
    "Semantic reading order, leading/trailing alignment.",
    "Symbols: decorative.",
    "SwiftUI environment, not duplicated state."
  ],
  "preview": {
    "screenshots": [
      "docs/images/items/direction-light.png",
      "docs/images/items/direction-dark.png"
    ]
  }
}
