{
  "$schema": "../schema.json",
  "schemaVersion": 1,
  "version": "0.1.2",
  "name": "settings-section",
  "kind": "block",
  "description": "Composes select, separator, button; structure, separators, messages, caller-owned toggle/picker/action rows.",
  "usage": "@State private var alertsEnabled = true\n@State private var marketingEnabled = false\n@State private var currency = \"KWD\"\nlet marketingAllowed = false\n\nSettingsSection(\n    \"Notifications\",\n    footer: Text(\"Quiet hours apply to every channel.\")\n) {\n    Toggle(\"Transaction alerts\", isOn: $alertsEnabled)\n        .settingsRowDescription(Text(\"A push notification for every card transaction.\"))\n\n    Toggle(\"Marketing messages\", isOn: $marketingEnabled)\n        .settingsRowDisabled(\n            !marketingAllowed,\n            explanation: Text(\"Managed by your organization's privacy policy.\")\n        )\n\n    LabeledContent(\"Currency\") {\n        Picker(\"Currency\", selection: $currency) {\n            Text(\"Kuwaiti dinar\").tag(\"KWD\")\n            Text(\"US dollar\").tag(\"USD\")\n        }\n        .registrySelect()\n    }\n\n    Button(\"Sign out\", role: .destructive) { }\n        .buttonStyle(.registry)\n}",
  "files": [
    {
      "source": "sources/blocks/SettingsSection.swift",
      "target": "SettingsSection.swift"
    }
  ],
  "registryDependencies": [
    "select",
    "separator",
    "button"
  ],
  "packageDependencies": [
    {
      "package": "SweetUI",
      "product": "SweetUIFoundations",
      "requirement": "0.x",
      "sourceURL": "https://github.com/mangobyte-dev/sweetui.git",
      "swiftPM": {
        "kind": "upToNextMinor",
        "minimumVersion": "0.5.0"
      }
    }
  ],
  "platforms": [
    {
      "name": "iOS",
      "minimumVersion": "26.0"
    }
  ],
  "tags": [
    "settings",
    "preferences",
    "section",
    "toggle",
    "form"
  ],
  "aliases": [
    "preferences",
    "settings-list",
    "notifications",
    "notification-settings",
    "account-settings"
  ],
  "accessibility": [
    "Section title: header trait; rotor jumps sections.",
    "Rows: native semantics, not hidden/renamed; name = label. `.labelsHidden()` label MUST get explicit label.",
    "settingsRowDisabled = native .disabled; dims via style, VoiceOver: dimmed. Description/explanation: contrast, outside-subtree.",
    "Disabled explanation: under-control static-text, not a hint. Enabled+explanation: unrepresentable, cleared-when-enabled.",
    "Row order: control, description, explanation, footer; follows declaration order (VoiceOver, Full-Keyboard-Access).",
    "System styles (.headline/.footnote), 44pt row-height, no fixed-heights: Dynamic Type/RTL reflow. No rotor-grouping (`accessibilityElement-children-contain`); controls stay own-elements."
  ],
  "preview": {
    "source": "sources/blocks/SettingsSection.swift",
    "name": "Settings Section",
    "screenshots": [
      "docs/images/items/settings-section-light.png",
      "docs/images/items/settings-section-dark.png"
    ]
  }
}
