{
  "$schema": "../schema.json",
  "schemaVersion": 1,
  "version": "0.3.1",
  "name": "preview",
  "kind": "block",
  "description": "Theme wall: 33 cards, registry + native; adaptive grid, compact one-column.",
  "usage": "PreviewWall()",
  "files": [
    {
      "source": "sources/blocks/Preview/PreviewWall.swift",
      "target": "Preview/PreviewWall.swift"
    },
    {
      "source": "sources/blocks/Preview/ActivateAgentDialog.swift",
      "target": "Preview/ActivateAgentDialog.swift"
    },
    {
      "source": "sources/blocks/Preview/AnalyticsCard.swift",
      "target": "Preview/AnalyticsCard.swift"
    },
    {
      "source": "sources/blocks/Preview/AnomalyAlert.swift",
      "target": "Preview/AnomalyAlert.swift"
    },
    {
      "source": "sources/blocks/Preview/AssignIssue.swift",
      "target": "Preview/AssignIssue.swift"
    },
    {
      "source": "sources/blocks/Preview/BarChartCard.swift",
      "target": "Preview/BarChartCard.swift"
    },
    {
      "source": "sources/blocks/Preview/BarVisualizer.swift",
      "target": "Preview/BarVisualizer.swift"
    },
    {
      "source": "sources/blocks/Preview/BookAppointment.swift",
      "target": "Preview/BookAppointment.swift"
    },
    {
      "source": "sources/blocks/Preview/CodespacesCard.swift",
      "target": "Preview/CodespacesCard.swift"
    },
    {
      "source": "sources/blocks/Preview/ContributionsActivity.swift",
      "target": "Preview/ContributionsActivity.swift"
    },
    {
      "source": "sources/blocks/Preview/Contributors.swift",
      "target": "Preview/Contributors.swift"
    },
    {
      "source": "sources/blocks/Preview/EnvironmentVariables.swift",
      "target": "Preview/EnvironmentVariables.swift"
    },
    {
      "source": "sources/blocks/Preview/FeedbackForm.swift",
      "target": "Preview/FeedbackForm.swift"
    },
    {
      "source": "sources/blocks/Preview/FileUpload.swift",
      "target": "Preview/FileUpload.swift"
    },
    {
      "source": "sources/blocks/Preview/DeveloperProfile.swift",
      "target": "Preview/DeveloperProfile.swift"
    },
    {
      "source": "sources/blocks/Preview/IconPreviewGrid.swift",
      "target": "Preview/IconPreviewGrid.swift"
    },
    {
      "source": "sources/blocks/Preview/InviteTeam.swift",
      "target": "Preview/InviteTeam.swift"
    },
    {
      "source": "sources/blocks/Preview/Invoice.swift",
      "target": "Preview/Invoice.swift"
    },
    {
      "source": "sources/blocks/Preview/LiveWaveform.swift",
      "target": "Preview/LiveWaveform.swift"
    },
    {
      "source": "sources/blocks/Preview/NoTeamMembers.swift",
      "target": "Preview/NoTeamMembers.swift"
    },
    {
      "source": "sources/blocks/Preview/NotFound.swift",
      "target": "Preview/NotFound.swift"
    },
    {
      "source": "sources/blocks/Preview/ObservabilityCard.swift",
      "target": "Preview/ObservabilityCard.swift"
    },
    {
      "source": "sources/blocks/Preview/PieChartCard.swift",
      "target": "Preview/PieChartCard.swift"
    },
    {
      "source": "sources/blocks/Preview/ReportBug.swift",
      "target": "Preview/ReportBug.swift"
    },
    {
      "source": "sources/blocks/Preview/ShippingAddress.swift",
      "target": "Preview/ShippingAddress.swift"
    },
    {
      "source": "sources/blocks/Preview/Shortcuts.swift",
      "target": "Preview/Shortcuts.swift"
    },
    {
      "source": "sources/blocks/Preview/SkeletonLoading.swift",
      "target": "Preview/SkeletonLoading.swift"
    },
    {
      "source": "sources/blocks/Preview/SleepReport.swift",
      "target": "Preview/SleepReport.swift"
    },
    {
      "source": "sources/blocks/Preview/StyleOverview.swift",
      "target": "Preview/StyleOverview.swift"
    },
    {
      "source": "sources/blocks/Preview/TypographySpecimen.swift",
      "target": "Preview/TypographySpecimen.swift"
    },
    {
      "source": "sources/blocks/Preview/UIElements.swift",
      "target": "Preview/UIElements.swift"
    },
    {
      "source": "sources/blocks/Preview/UsageCard.swift",
      "target": "Preview/UsageCard.swift"
    },
    {
      "source": "sources/blocks/Preview/Visitors.swift",
      "target": "Preview/Visitors.swift"
    },
    {
      "source": "sources/blocks/Preview/WeeklyFitnessSummary.swift",
      "target": "Preview/WeeklyFitnessSummary.swift"
    }
  ],
  "registryDependencies": [
    "card",
    "item",
    "alert",
    "badge",
    "button",
    "chart",
    "empty",
    "avatar",
    "combobox",
    "separator",
    "field",
    "input-group",
    "spinner",
    "checkbox",
    "textarea",
    "input",
    "table",
    "kbd",
    "progress",
    "select",
    "skeleton",
    "button-group"
  ],
  "packageDependencies": [
    {
      "package": "SweetUI",
      "product": "SweetUIFoundations",
      "requirement": "0.x",
      "sourceURL": "https://github.com/mangobyte-dev/sweetui.git",
      "swiftPM": {
        "kind": "upToNextMinor",
        "minimumVersion": "0.5.0"
      }
    }
  ],
  "platforms": [
    {
      "name": "iOS",
      "minimumVersion": "26.0"
    }
  ],
  "tags": [
    "preview",
    "theme",
    "showcase",
    "cards",
    "create",
    "shadcn",
    "dashboard"
  ],
  "aliases": [
    "theme-preview",
    "create",
    "wall",
    "gallery"
  ],
  "accessibility": [
    "33 cards, one wall; regular: adaptive grid; compact: plain-non-lazy-VStack, all off-screen too (capture-route audit).",
    "Controls: accessibility label; SF Symbol hidden; no unlabeled button, image, switch, field, slider.",
    "Avatars: person/account name label. Charts, gauges, keycaps: spoken labels, not glyphs.",
    "Dialog actions: native alert/sheet; keeps modal semantics, focus.",
    "Cards: native GroupBox + controls, card-surface; respects Dynamic Type, color-scheme, direction, no-per-card-handling."
  ],
  "preview": {
    "source": "sources/blocks/Preview/PreviewWall.swift",
    "name": "Preview Wall",
    "screenshots": [
      "docs/images/items/preview-light.png",
      "docs/images/items/preview-dark.png"
    ]
  }
}
