{
  "$schema": "../schema.json",
  "schemaVersion": 1,
  "version": "0.1.1",
  "name": "toast",
  "kind": "component",
  "description": "Transient status toast: informational, positive, destructive; optional action; swipe/tap/timed dismissal.",
  "usage": "@State private var toast: RegistryToast?\n\nCardDetail()\n    .registryToast($toast)\n\n// Present a destructive toast with an undo action:\ntoast = RegistryToast(\n    title: \"Message deleted\",\n    message: \"You can undo this for a few seconds.\",\n    variant: .destructive,\n    action: RegistryToast.Action(label: \"Undo\") { restoreMessage() }\n)",
  "files": [
    {
      "source": "sources/components/RegistryToastModifier.swift",
      "target": "RegistryToastModifier.swift"
    }
  ],
  "registryDependencies": [
    "button"
  ],
  "packageDependencies": [
    {
      "package": "SweetUI",
      "product": "SweetUIFoundations",
      "requirement": "0.x",
      "sourceURL": "https://github.com/mangobyte-dev/sweetui.git",
      "swiftPM": {
        "kind": "upToNextMinor",
        "minimumVersion": "0.5.0"
      }
    }
  ],
  "platforms": [
    {
      "name": "iOS",
      "minimumVersion": "26.0"
    }
  ],
  "tags": [
    "toast",
    "snackbar",
    "notification",
    "feedback",
    "status",
    "shadcn"
  ],
  "aliases": [
    "snackbar",
    "sonner",
    "notification-banner",
    "added-to-cart",
    "confirmation",
    "refresh",
    "refreshed"
  ],
  "accessibility": [
    "Variant pairs symbol with color. MUST NOT rely on color alone.",
    "Posts VoiceOver announcement from title+message; keeps focus.",
    "Title+message combine; action, close stay separate.",
    "Close carries Dismiss label; symbol hidden; tone via text.",
    "Reduce Motion: fade not slide; title shrinks; message wraps 2 lines."
  ],
  "preview": {
    "source": "sources/components/RegistryToastModifier.swift",
    "name": "Toast",
    "screenshots": [
      "docs/images/items/toast-light.png",
      "docs/images/items/toast-dark.png"
    ]
  }
}
