{
  "$schema": "../schema.json",
  "schemaVersion": 1,
  "version": "0.2.1",
  "name": "command-search",
  "kind": "block",
  "description": "Composes command, keycap; caller owns query, filtering, sections, legend.",
  "usage": "@State private var query = \"\"\n\nCommandSearch(\n    \"Search\",\n    query: $query,\n    prompt: \"Search actions and activity\",\n    sections: sections,\n    emptyDescription: Text(\"Try a payee, a card, or an action.\"),\n    shortcuts: [\n        CommandShortcutHint(\"Open search\", keys: \"⌘K\", keysLabel: Text(\"Command K\"))\n    ],\n    onSelect: { id in }\n)",
  "files": [
    {
      "source": "sources/blocks/CommandSearch.swift",
      "target": "CommandSearch.swift"
    }
  ],
  "registryDependencies": [
    "command",
    "kbd"
  ],
  "packageDependencies": [
    {
      "package": "SweetUI",
      "product": "SweetUIFoundations",
      "requirement": "0.x",
      "sourceURL": "https://github.com/mangobyte-dev/sweetui.git",
      "swiftPM": {
        "kind": "upToNextMinor",
        "minimumVersion": "0.5.0"
      }
    }
  ],
  "platforms": [
    {
      "name": "iOS",
      "minimumVersion": "26.0"
    }
  ],
  "tags": [
    "search",
    "command",
    "palette",
    "shortcuts",
    "screen"
  ],
  "aliases": [
    "spotlight",
    "quick-actions",
    "global-search"
  ],
  "accessibility": [
    "Field: prompt. Commands: Buttons, combined-label. Titles headers.",
    "No results: ContentUnavailableView, copy, never blank.",
    "Legend: action-shortcut merge; keycaps hidden unless labeled.",
    "Selection/filtering/query caller-owned; no self-trigger."
  ],
  "preview": {
    "source": "sources/blocks/CommandSearch.swift",
    "name": "Command Search",
    "screenshots": [
      "docs/images/items/command-search-light.png",
      "docs/images/items/command-search-dark.png"
    ]
  }
}
