{
  "$schema": "../schema.json",
  "schemaVersion": 1,
  "version": "0.1.1",
  "name": "bubble",
  "kind": "component",
  "description": "Wraps text: incoming, outgoing, muted; aligns with message row.",
  "usage": "Text(\"Are we still on for Thursday?\")\n    .registryBubble(.incoming)\n\nText(\"Yes, 6pm works.\")\n    .registryBubble(.outgoing)",
  "files": [
    {
      "source": "sources/components/RegistryBubbleModifier.swift",
      "target": "RegistryBubbleModifier.swift"
    }
  ],
  "registryDependencies": [],
  "packageDependencies": [
    {
      "package": "SweetUI",
      "product": "SweetUIFoundations",
      "requirement": "0.x",
      "sourceURL": "https://github.com/mangobyte-dev/sweetui.git",
      "swiftPM": {
        "kind": "upToNextMinor",
        "minimumVersion": "0.5.0"
      }
    }
  ],
  "platforms": [
    {
      "name": "iOS",
      "minimumVersion": "26.0"
    }
  ],
  "tags": [
    "bubble",
    "chat",
    "message",
    "conversation",
    "modifier",
    "shadcn"
  ],
  "aliases": [
    "chat-bubble",
    "speech-bubble"
  ],
  "accessibility": [
    "Text wraps, MUST NOT truncate; grows Dynamic Type.",
    "No added element; keeps semantics, reading order.",
    "Fill, no stroke; outgoing uses tint, onAccent MUST stay legible.",
    "Muted: border hairline, no fill; reads distinct without color.",
    "Inherits layout direction; padding/corners follow locale."
  ],
  "preview": {
    "source": "sources/components/RegistryBubbleModifier.swift",
    "name": "Bubble Variants",
    "screenshots": [
      "docs/images/items/bubble-light.png",
      "docs/images/items/bubble-dark.png"
    ]
  }
}
