{
  "$schema": "../schema.json",
  "schemaVersion": 1,
  "version": "0.1.1",
  "name": "dropdown-menu",
  "kind": "recipe",
  "description": "Menu trigger guidance.",
  "usage": "@State private var sort = \"recent\"\n\nMenu(\"Sort\", systemImage: \"arrow.up.arrow.down\") {\n    Picker(\"Sort by\", selection: $sort) {\n        Text(\"Most recent\").tag(\"recent\")\n        Text(\"Amount\").tag(\"amount\")\n    }\n    Divider()\n    Button(\"Export\", systemImage: \"square.and.arrow.up\") { }\n}\n.buttonStyle(.registryOutline)\n.registryItem(\"dropdown-menu\")",
  "docs": "`Menu`: dropdown-actions. `Picker` inside: checkmarked-group; `Divider`: section. Trigger: any registry button style.",
  "files": [],
  "registryDependencies": [
    "button"
  ],
  "packageDependencies": [
    {
      "package": "SweetUI",
      "product": "SweetUIFoundations",
      "requirement": "0.x",
      "sourceURL": "https://github.com/mangobyte-dev/sweetui.git",
      "swiftPM": {
        "kind": "upToNextMinor",
        "minimumVersion": "0.5.0"
      }
    }
  ],
  "platforms": [
    {
      "name": "iOS",
      "minimumVersion": "26.0"
    }
  ],
  "tags": [
    "dropdown",
    "menu",
    "actions",
    "picker",
    "guidance"
  ],
  "aliases": [
    "dropdown",
    "menu"
  ],
  "accessibility": [
    "Trigger: text label default; symbol-only MUST have accessibility label.",
    "Picker selection: announces checked state.",
    "Presentation, dismissal, Liquid-Glass: system."
  ],
  "preview": {
    "screenshots": [
      "docs/images/items/dropdown-menu-light.png",
      "docs/images/items/dropdown-menu-dark.png"
    ]
  }
}
