{
  "$schema": "../schema.json",
  "schemaVersion": 1,
  "version": "0.3.1",
  "name": "sidebar",
  "kind": "recipe",
  "description": "Sidebar: NavigationSplitView + selection-bound List (iPad).",
  "usage": "@State private var selection: String? = \"activity\"\n@State private var tab = \"activity\"\n\nNavigationSplitView {\n    List(selection: $selection) {\n        Label(\"Activity\", systemImage: \"bell\").tag(\"activity\")\n        Label(\"Cards\", systemImage: \"creditcard\").tag(\"cards\")\n    }\n    .navigationTitle(\"Bank\")\n    .navigationSplitViewColumnWidth(min: 200, ideal: 240, max: 320)\n} detail: {\n    // A visually rich detail extends under the sidebar instead of stopping at its edge\n    ActivityBanner()\n        .backgroundExtensionEffect()\n    if selection == \"activity\" { ActivityScreen() } else { CardsScreen() }\n}\n.registryItem(\"sidebar\")\n\n// The HIG's first choice on iPad: a tab bar people can switch to a sidebar\nTabView(selection: $tab) {\n    Tab(\"Activity\", systemImage: \"bell\", value: \"activity\") { ActivityScreen() }\n    Tab(\"Cards\", systemImage: \"creditcard\", value: \"cards\") { CardsScreen() }\n}\n.tabViewStyle(.sidebarAdaptable)",
  "docs": "`NavigationSplitView` + selection-bound `List`: iPhone-stack, column-toggle; keyboard/pointer selection. MUST NOT rebuild via HStack. iPadOS drags divider (`navigationSplitViewColumnWidth`); iPhone ignores. `TabView`+`.sidebarAdaptable` first: tab-bar or sidebar, switches, adapts width (HIG pick). Else `NavigationSplitView` for sidebar-only. Rich detail extends beneath via `backgroundExtensionEffect()` (26.0), past edge (HIG: sidebar-over-content).",
  "files": [],
  "registryDependencies": [],
  "packageDependencies": [
    {
      "package": "SweetUI",
      "product": "SweetUIFoundations",
      "requirement": "0.x",
      "sourceURL": "https://github.com/mangobyte-dev/sweetui.git",
      "swiftPM": {
        "kind": "upToNextMinor",
        "minimumVersion": "0.5.0"
      }
    }
  ],
  "platforms": [
    {
      "name": "iOS",
      "minimumVersion": "26.0"
    }
  ],
  "tags": [
    "sidebar",
    "navigation",
    "split-view",
    "ipad",
    "guidance"
  ],
  "aliases": [
    "split-view",
    "navigation-split-view",
    "sidebar-adaptable"
  ],
  "accessibility": [
    "Sidebar rows: native cells, selection semantics.",
    "Column toggle: system-provided, labeled.",
    "Selection state: caller-owned via binding.",
    "Tab/sidebar switch: system control, own label; tabs keep native semantics.",
    "Background extension: mirrors pixels beneath sidebar; no accessibility element, hides nothing."
  ],
  "preview": {
    "screenshots": [
      "docs/images/items/sidebar-light.png",
      "docs/images/items/sidebar-dark.png"
    ]
  }
}
