{
  "$schema": "../schema.json",
  "schemaVersion": 1,
  "version": "0.1.1",
  "name": "typography",
  "kind": "recipe",
  "description": "Styles = type scale: weight, design, monospaced digits.",
  "usage": "VStack(alignment: .leading, spacing: 8) {\n    Text(\"Balance\")\n        .font(.title2.weight(.semibold))\n    Text(amount, format: .currency(code: \"KWD\"))\n        .font(.largeTitle)\n        .monospacedDigit()\n    Text(\"Updated today\")\n        .font(.footnote)\n        .foregroundStyle(.secondary)\n}\n.fontDesign(.rounded)\n.registryItem(\"typography\")",
  "docs": "`.largeTitle`-`.caption2`: 11 styles, type scale, with Dynamic Type. `.fontDesign` (root) sets typographic voice. `.monospacedDigit()` aligns figures (currency).",
  "files": [],
  "registryDependencies": [],
  "packageDependencies": [
    {
      "package": "SweetUI",
      "product": "SweetUIFoundations",
      "requirement": "0.x",
      "sourceURL": "https://github.com/mangobyte-dev/sweetui.git",
      "swiftPM": {
        "kind": "upToNextMinor",
        "minimumVersion": "0.5.0"
      }
    }
  ],
  "platforms": [
    {
      "name": "iOS",
      "minimumVersion": "26.0"
    }
  ],
  "tags": [
    "typography",
    "text-styles",
    "font",
    "type-scale",
    "guidance"
  ],
  "aliases": [
    "text-styles",
    "type-scale"
  ],
  "accessibility": [
    "Scales with Dynamic Type, accessibility sizes; no hardcoded points.",
    "Regular-Bold: legible; below Regular thins, fails at small sizes."
  ],
  "preview": {
    "screenshots": [
      "docs/images/items/typography-light.png",
      "docs/images/items/typography-dark.png"
    ]
  }
}
