{
  "$schema": "../schema.json",
  "schemaVersion": 1,
  "version": "0.1.1",
  "name": "combobox",
  "kind": "component",
  "description": "Searchable single-selection: search field, filtered list, binding-driven selection, native empty state.",
  "usage": "@State private var timezone: String? = \"riyadh\"\n\nCombobox(\n    selection: $timezone,\n    options: [\n        ComboboxOption(id: \"kuwait\", title: \"Kuwait City\", systemImage: \"clock\"),\n        ComboboxOption(id: \"riyadh\", title: \"Riyadh\", systemImage: \"clock\")\n    ],\n    prompt: \"Search time zones\",\n    emptyDescription: Text(\"Try a city name.\")\n)",
  "files": [
    {
      "source": "sources/components/Combobox.swift",
      "target": "Combobox.swift"
    }
  ],
  "registryDependencies": [
    "input-group",
    "item",
    "empty",
    "separator",
    "button"
  ],
  "packageDependencies": [
    {
      "package": "SweetUI",
      "product": "SweetUIFoundations",
      "requirement": "0.x",
      "sourceURL": "https://github.com/mangobyte-dev/sweetui.git",
      "swiftPM": {
        "kind": "upToNextMinor",
        "minimumVersion": "0.5.0"
      }
    }
  ],
  "platforms": [
    {
      "name": "iOS",
      "minimumVersion": "26.0"
    }
  ],
  "tags": [
    "combobox",
    "search",
    "select",
    "autocomplete",
    "picker",
    "shadcn"
  ],
  "aliases": [
    "autocomplete",
    "typeahead",
    "searchable-select",
    "dropdown"
  ],
  "accessibility": [
    "Field label: prompt, query binding; options: native Buttons, titled, Voice-Control ready.",
    "Selected: isSelected trait, checkmark; symbol decorative, hidden.",
    "No match: ContentUnavailableView on registry surface (caller's empty title/description).",
    "Focus: list opens inline below, pushes content; MUST NOT hide controls. No popover (full sheet on compact iPhone)."
  ],
  "preview": {
    "source": "sources/components/Combobox.swift",
    "name": "Combobox",
    "screenshots": [
      "docs/images/items/combobox-light.png",
      "docs/images/items/combobox-dark.png"
    ]
  }
}
