{
  "$schema": "../schema.json",
  "schemaVersion": 1,
  "version": "0.1.1",
  "name": "date-picker",
  "kind": "recipe",
  "description": "Compact DatePicker, closed range, presets Menu.",
  "usage": "@State private var date = Date.now\n\nDatePicker(\"Statement date\", selection: $date, in: range, displayedComponents: .date)\n    .datePickerStyle(.compact)\n    .registryItem(\"date-picker\")\n\nMenu(\"Presets\") {\n    Button(\"Today\") { date = .now }\n    Button(\"Tomorrow\") { date = .now.addingTimeInterval(60 * 60 * 24) }\n    Button(\"Next week\") { date = .now.addingTimeInterval(60 * 60 * 24 * 7) }\n}\n.accessibilityLabel(\"Date presets\")",
  "docs": "`DatePicker` `.compact` + `ClosedRange<Date>` restricts pickable dates. `Menu` presets write binding. `calendar`: graphical month view. Compact = single tap target; no wrapper. Empty/reversed range traps at one date.",
  "files": [],
  "registryDependencies": [],
  "packageDependencies": [
    {
      "package": "SweetUI",
      "product": "SweetUIFoundations",
      "requirement": "0.x",
      "sourceURL": "https://github.com/mangobyte-dev/sweetui.git",
      "swiftPM": {
        "kind": "upToNextMinor",
        "minimumVersion": "0.5.0"
      }
    }
  ],
  "platforms": [
    {
      "name": "iOS",
      "minimumVersion": "26.0"
    }
  ],
  "tags": [
    "date-picker",
    "date",
    "calendar",
    "presets",
    "guidance"
  ],
  "aliases": [
    "date-field",
    "date-input"
  ],
  "accessibility": [
    "DatePicker: title = accessibility label; reads date.",
    "Label presets Menu; clear without visible glyph."
  ],
  "preview": {
    "screenshots": [
      "docs/images/items/date-picker-light.png",
      "docs/images/items/date-picker-dark.png"
    ]
  }
}
