{
  "$schema": "../schema.json",
  "schemaVersion": 1,
  "version": "0.3.2",
  "name": "badge",
  "kind": "component",
  "description": "Primary, secondary, outline, positive, destructive: Text/Label treatments.",
  "usage": "Text(\"New\")\n    .registryBadge()\n\nLabel(\"Completed\", systemImage: \"checkmark.circle.fill\")\n    .registryBadge(.positive)",
  "files": [
    {
      "source": "sources/components/RegistryBadge.swift",
      "target": "RegistryBadge.swift"
    }
  ],
  "registryDependencies": [],
  "packageDependencies": [
    {
      "package": "SweetUI",
      "product": "SweetUIFoundations",
      "requirement": "0.x",
      "sourceURL": "https://github.com/mangobyte-dev/sweetui.git",
      "swiftPM": {
        "kind": "upToNextMinor",
        "minimumVersion": "0.5.0"
      }
    }
  ],
  "platforms": [
    {
      "name": "iOS",
      "minimumVersion": "26.0"
    }
  ],
  "tags": [
    "badge",
    "label",
    "status",
    "category",
    "modifier"
  ],
  "aliases": [
    "chip",
    "tag",
    "pill",
    "price",
    "price-tag",
    "discount",
    "unread",
    "unread-count",
    "counter",
    "verified"
  ],
  "accessibility": [
    "One line, intrinsic width.",
    "Preserves semantics, reading order.",
    "System style; grows Dynamic Type.",
    "Inherits layout direction; locale-aware.",
    "Positive/destructive: same fill, differ hue; pair symbol, MUST NOT rely on color alone."
  ],
  "preview": {
    "source": "sources/components/RegistryBadge.swift",
    "name": "Badge Variants",
    "screenshots": [
      "docs/images/items/badge-light.png",
      "docs/images/items/badge-dark.png"
    ]
  }
}
