{
  "$schema": "../schema.json",
  "schemaVersion": 1,
  "version": "0.3.1",
  "name": "switch",
  "kind": "recipe",
  "description": "Toggle: switch style; inherits tint, environment.",
  "usage": "@State private var notifications = true\n\nToggle(\"Notifications\", isOn: $notifications)\n    .toggleStyle(.switch)\n    .registryItem(\"switch\")",
  "docs": "`.toggleStyle(.switch)` on `Toggle`; no wrapper.",
  "files": [],
  "registryDependencies": [],
  "packageDependencies": [
    {
      "package": "SweetUI",
      "product": "SweetUIFoundations",
      "requirement": "0.x",
      "sourceURL": "https://github.com/mangobyte-dev/sweetui.git",
      "swiftPM": {
        "kind": "upToNextMinor",
        "minimumVersion": "0.5.0"
      }
    }
  ],
  "platforms": [
    {
      "name": "iOS",
      "minimumVersion": "26.0"
    }
  ],
  "tags": [
    "switch",
    "toggle",
    "setting",
    "boolean",
    "guidance"
  ],
  "aliases": [
    "toggle-switch"
  ],
  "accessibility": [
    "Retains Toggle semantics, announcements; needs visible/accessibility label.",
    "Inherits tint, enabled, Dynamic Type, direction; no interaction/animation changes."
  ],
  "preview": {
    "screenshots": [
      "docs/images/items/switch-light.png",
      "docs/images/items/switch-dark.png"
    ]
  }
}
