{
  "$schema": "../schema.json",
  "schemaVersion": 1,
  "version": "0.1.2",
  "name": "context-menu",
  "kind": "recipe",
  "description": "Native .contextMenu: labeled, role-tagged buttons.",
  "usage": "TransactionRow(\n    title: Text(\"Mishmash Bakery\"),\n    subtitle: Text(\"Today, 09:41\"),\n    amount: Text(-8.75, format: .currency(code: \"KWD\")),\n    systemImage: \"cup.and.saucer.fill\"\n)\n.registryTone(.negative)\n.contextMenu {\n    Button(\"Add note\", systemImage: \"square.and.pencil\") { }\n    Button(\"Share\", systemImage: \"square.and.arrow.up\") { }\n    Divider()\n    Button(\"Report\", systemImage: \"flag\", role: .destructive) { }\n}\n.registryItem(\"context-menu\")",
  "docs": "`.contextMenu` + Buttons: symbols, roles. System renders Liquid Glass menu, preview, haptics. Long press isn't discoverable.",
  "files": [],
  "registryDependencies": [
    "transaction-row"
  ],
  "packageDependencies": [
    {
      "package": "SweetUI",
      "product": "SweetUIFoundations",
      "requirement": "0.x",
      "sourceURL": "https://github.com/mangobyte-dev/sweetui.git",
      "swiftPM": {
        "kind": "upToNextMinor",
        "minimumVersion": "0.5.0"
      }
    }
  ],
  "platforms": [
    {
      "name": "iOS",
      "minimumVersion": "26.0"
    }
  ],
  "tags": [
    "context-menu",
    "long-press",
    "actions",
    "menu",
    "guidance"
  ],
  "aliases": [
    "long-press",
    "menu"
  ],
  "accessibility": [
    "Menus: VoiceOver actions rotor.",
    "Destructive: system style only.",
    "Actions MUST also exist visibly (detail screen)."
  ],
  "preview": {
    "screenshots": [
      "docs/images/items/context-menu-light.png",
      "docs/images/items/context-menu-dark.png"
    ]
  }
}
