{
  "$schema": "../schema.json",
  "schemaVersion": 1,
  "version": "0.1.1",
  "name": "marker",
  "kind": "component",
  "description": "Marker style: note, status, separator variants (system line, delivery pill, date rule).",
  "usage": "Text(\"Today\")\n    .registryMarker(.separator)\n\nText(\"Maya joined the conversation\")\n    .registryMarker()\n\nText(\"Delivered 09:41\")\n    .registryMarker(.status)",
  "files": [
    {
      "source": "sources/components/RegistryMarkerModifier.swift",
      "target": "RegistryMarkerModifier.swift"
    }
  ],
  "registryDependencies": [
    "separator"
  ],
  "packageDependencies": [
    {
      "package": "SweetUI",
      "product": "SweetUIFoundations",
      "requirement": "0.x",
      "sourceURL": "https://github.com/mangobyte-dev/sweetui.git",
      "swiftPM": {
        "kind": "upToNextMinor",
        "minimumVersion": "0.5.0"
      }
    }
  ],
  "platforms": [
    {
      "name": "iOS",
      "minimumVersion": "26.0"
    }
  ],
  "tags": [
    "marker",
    "conversation",
    "chat",
    "timeline",
    "divider",
    "shadcn"
  ],
  "aliases": [
    "system-message",
    "divider-label",
    "conversation-note"
  ],
  "accessibility": [
    "Status variant hides clock symbol.",
    "Separator rules decorative; label reads.",
    "One line; shrinks before wrap. MUST NOT break.",
    "Scales with Dynamic Type; follows layout direction."
  ],
  "preview": {
    "source": "sources/components/RegistryMarkerModifier.swift",
    "name": "Marker",
    "screenshots": [
      "docs/images/items/marker-light.png",
      "docs/images/items/marker-dark.png"
    ]
  }
}
