{
  "$schema": "../schema.json",
  "schemaVersion": 1,
  "version": "0.1.2",
  "name": "attachment",
  "kind": "component",
  "description": "Row: square media, name, detail, caller actions. States: idle, uploading, processing, failed, completed.",
  "usage": "AttachmentRow(\n    name: Text(\"Statement-Aug-2026.pdf\"),\n    detail: Text(\"PDF document, 1.2 MB\"),\n    state: .uploading(progress: 0.68)\n) {\n    Image(systemName: \"doc.fill\")\n} actions: {\n    Button(\"Cancel\", systemImage: \"xmark\") {}\n        .labelStyle(.iconOnly)\n        .buttonStyle(.registryGhost)\n        .accessibilityLabel(\"Cancel upload\")\n}\n\n// A completed attachment with a thumbnail and no actions: the bare trailing closure is the thumbnail.\nAttachmentRow(\n    name: Text(\"Receipt.jpg\"),\n    detail: Text(\"Image, 240 KB\"),\n    state: .completed\n) {\n    Image(systemName: \"photo\")\n}",
  "files": [
    {
      "source": "sources/components/AttachmentRow.swift",
      "target": "AttachmentRow.swift"
    }
  ],
  "registryDependencies": [
    "item",
    "progress",
    "button",
    "separator"
  ],
  "packageDependencies": [
    {
      "package": "SweetUI",
      "product": "SweetUIFoundations",
      "requirement": "0.x",
      "sourceURL": "https://github.com/mangobyte-dev/sweetui.git",
      "swiftPM": {
        "kind": "upToNextMinor",
        "minimumVersion": "0.5.0"
      }
    }
  ],
  "platforms": [
    {
      "name": "iOS",
      "minimumVersion": "26.0"
    }
  ],
  "tags": [
    "attachment",
    "file",
    "upload",
    "row",
    "media",
    "shadcn"
  ],
  "aliases": [
    "upload",
    "file-row"
  ],
  "accessibility": [
    "State text: percent, Processing, failure, Uploaded; MUST NOT rely on color/bar.",
    "VoiceOver skips percent; bar reports it.",
    "ItemRow: name+detail one element; actions separate, activatable.",
    "Failed/completed: color, symbol, word; not hue-only.",
    "Icon buttons, thumbnail MUST label, not text-derived."
  ],
  "preview": {
    "source": "sources/components/AttachmentRow.swift",
    "name": "Attachment Row",
    "screenshots": [
      "docs/images/items/attachment-light.png",
      "docs/images/items/attachment-dark.png"
    ]
  }
}
