{
  "$schema": "../schema.json",
  "schemaVersion": 1,
  "version": "0.3.1",
  "name": "slider",
  "kind": "recipe",
  "description": "Slider: tint, sizing; caller-owned value, labels.",
  "usage": "@State private var volume = 64.0\n\nSlider(value: $volume, in: 0...100, step: 1) {\n    Text(\"Volume\")\n} minimumValueLabel: {\n    Image(systemName: \"speaker.fill\")\n        .accessibilityHidden(true)\n} maximumValueLabel: {\n    Image(systemName: \"speaker.wave.3.fill\")\n        .accessibilityHidden(true)\n}\n.controlSize(.large)\n.registryItem(\"slider\")",
  "docs": "Use the native `Slider` with `.tint(_:)` and `.controlSize(_:)` where the design needs them. The registry adds no wrapper: those modifiers only forward environment values the control already respects.",
  "files": [],
  "registryDependencies": [],
  "packageDependencies": [
    {
      "package": "SweetUI",
      "product": "SweetUIFoundations",
      "requirement": "0.x",
      "sourceURL": "https://github.com/mangobyte-dev/sweetui.git",
      "swiftPM": {
        "kind": "upToNextMinor",
        "minimumVersion": "0.5.0"
      }
    }
  ],
  "platforms": [
    {
      "name": "iOS",
      "minimumVersion": "26.0"
    }
  ],
  "tags": [
    "slider",
    "value",
    "range",
    "control",
    "guidance"
  ],
  "aliases": [
    "range",
    "amount-range",
    "price-range"
  ],
  "accessibility": [
    "Retains Slider semantics, gestures; caller-owned value, bounds, step, callbacks.",
    "Needs meaningful label; supports min/max labels; inherits size, enabled, direction (overridable)."
  ],
  "preview": {
    "screenshots": [
      "docs/images/items/slider-light.png",
      "docs/images/items/slider-dark.png"
    ]
  }
}
